{
  "@context": [
    "https://www.w3.org/ns/credentials/v2",
    "https://raw.githubusercontent.com/nfh-trust-labs/opencred-vc-schemas/main/schemas/prescription/v1/context.jsonld"
  ],
  "id": "urn:uuid:00000000-0000-4000-8000-000000000001",
  "type": [
    "VerifiableCredential",
    "PrescriptionCredential"
  ],
  "issuer": {
    "id": "did:web:issuer.example",
    "name": "Example Issuer"
  },
  "validFrom": "2026-04-08T00:00:00Z",
  "credentialSubject": {
    "id": "did:example:subject",
    "medication": {
      "code": {
        "system": "http://www.nlm.nih.gov/research/umls/rxnorm",
        "code": "310798",
        "display": "Amoxicillin 500 MG Oral Capsule"
      },
      "form": "capsule",
      "strength": "500 mg"
    },
    "patient": {
      "name": "John Smith",
      "dateOfBirth": "1982-09-03"
    },
    "authoredOn": "2026-04-01T09:15:00Z",
    "requester": {
      "name": "Dr. Alan Turing",
      "registrationNumber": "GMC-987654",
      "specialty": "General Practice"
    },
    "intent": "order",
    "status": "active",
    "dosageInstruction": {
      "text": "Take 1 capsule three times daily for 7 days",
      "timing": "TID",
      "route": "oral",
      "doseQuantity": {
        "value": 1,
        "unit": "capsule"
      }
    },
    "dispenseRequest": {
      "quantity": {
        "value": 21,
        "unit": "capsule"
      },
      "numberOfRepeatsAllowed": 0
    }
  }
}
